{
  "schemaVersion": "1.0.0",
  "eventId": "01J9E0000000000000000DL3",
  "kind": "DELEGATION",
  "occurredAtUtc": "2026-08-10T09:25:00Z",
  "rootId": "01J8Z0000000000000000RT1",
  "delegationId": "01J9D0000000000000000DG3",
  "delegationKind": "AUTO_DEFAULT",
  "chosenRef": "cloud-model:anthropic:claude?api_key=sk-ant-api03-FAKE1234567890abcdEFGHijklMNOPqrstUVWXyz0000000000AA",
  "alternatives": ["cloud-model:openai:gpt (Authorization: Bearer sk-live-FAKE0000000000000000000000000000)"] ,
  "outcome": "KEPT",
  "outcomeAt": "2026-08-10T09:40:00Z",
  "unknownFields": {}
}
